hekayt,bab
"پیرمرد‌ی را گفتند: چرا زن نکنی؟ گفت: با پیرزنانم عیشی نباشد. گفتند: جوانی بخواه چو مکنت داری. گفت: مرا که پیرم با پیرزنان الفت نیست پس او را که جوان باشد با من که پیرم چه دوستی صورت بندد؟ پِرِ هَفتا ثَله جُونی می‌کُند
عَشغِ مقری وَ خُیْ بِنی چِشِ رُوشْت زور باید نه زر که بانو را
گزر‌ی دوست‌تر که ده من گوشت",6
"شنیده‌ام که در این روزها کهن پیری
خیال بست به پیرانه سر که گیرد جفت بخواست دخترکی خوبروی گوهر نام
چو درج گوهرش از چشم مردمان بنهفت چنان که رسم عروسی بود تماشا بود
ولی به حملهٔ اوّل عصای شیخ بخفت کمان کشید و نزد بر هدف که نتوان دوخت
مگر به خامهٔ فولاد جامهٔ هنگفت به دوستان گله آغاز کرد و حجت ساخت
که خان و مان من این شوخ دیده پاک برفت میان شوهر و زن جنگ و فتنه خاست چنان
که سر به شحنه و قاضی کشید و سعدی گفت: پس از خلافت و شنعت گناه دختر نیست
تو را که دست بلرزد گهر چه دانی سفت سود دریا نیک بودی گر نبودی بیم موج
صحبت گل خوش بدی گر نیستی تشویش خار دوش چون طاووس می نازیدم اندر باغ وصل
دیگر امروز از فراق یار می پیچم چو مار",6
"یکی را از وزرا پسری کودن بود. پیش یکی از دانشمندان فرستاد که مر این را تربیتی می‌کن مگر که عاقل شود. روزگاری تعلیم کردش و مؤثر نبود. پیش پدرش کس فرستاد که این عاقل نمی‌باشد و مرا دیوانه کرد. چون بود اصل گوهری قابل
تربیت را در او اثر باشد هیچ صیقل نکو نداند کرد
آهنی را که بدگهر باشد سگ به دریای هفتگانه بشوی
که چو تر شد پلیدتر باشد خر عیسی گرش به مکه برند
چون بیاید هنوز خر باشد",7
"حکیمی پسران را پند همی‌داد که جانان پدر، هنر آموزید که مُلک و دولت دنیا اعتماد را نشاید و سیم و زر، در سفر بر محل خطر است؛ یا دزد به یک‌بار بِبَرد یا خواجه به تَفاریق بخورد. اما هنر چشمهٔ زاینده است و دولت پاینده وگر هنرمند از دولت بیفتد غم نباشد که هنر در نفس خود دولت است؛ هر جا که رود قدر بیند و در صدر نشیند و بی هنر لقمه چیند و سختی بیند. سخت است پس از جاه تَحَکُّم بردن
خو کرده به ناز، جور مردم بردن وقتی افتاد فتنه‌ای در شام
هر کس از گوشه‌ای فرا رفتند روستازادگان دانشمند
به وزیریّ پادشا رفتند پسران وزیر ناقص‌عقل
به گدایی به روستا رفتند",7
"یکی از فضلا تعلیم ملک زاده‌ای همی‌داد و ضرب بی محابا زدی و زجر بی قیاس کردی. باری پسر از بی طاقتی شکایت پیش پدر برد و جامه از تن دردمند برداشت. پدر را دل به هم بر آمد. استاد را گفت که پسران آحاد رعیت را چندین جفا و توبیخ روا نمی داری که فرزند مرا سبب چیست؟ گفت: سبب آن که سخن اندیشیده باید گفت و حرکت پسندیده کردن همه خلق را علی العموم و پادشاهان را علی الخصوص، به موجب آن که بر دست و زبان ایشان هر چه رفته شود هر آینه به افواه بگویند و قول و فعل عوام الناس را چندان اعتباری نباشد. اگر صد ناپسند آید ز درویش
رفیقانش یکی از صد ندانند وگر یک بذله گوید پادشاهی
از اقلیمی به اقلیمی رسانند پس واجب آمد معلم پادشه زاده را در تهذیب اخلاق خداوندزادگان أنبَتَهم اللهُ نباتاً حسناً اجتهاد از آن بیش کردن که در حقّ عوام. هر که در خردیش ادب نکنند
در بزرگی فلاح از او برخاست چوب تر را چنان که خواهی پیچ
نشود خشک جز به آتش راست ملک را حسن تدبیر فقیه و تقریر جواب او موافق رای آمد. خلعت و نعمت بخشید و پایه منصب بلند گردانید.",7
"معلم کُتّابی دیدم در دیار مغرب، ترشرویِ تلخ‌گفتار بدخویِ مردم‌آزار گداطبعِ ناپرهیزگار، که عیش مسلمانان به دیدن او تبه گشتی و خواندن قرآنش دل مردم سیه کردی. جمعی پسران پاکیزه و دختران دوشیزه به دست جفای او گرفتار، نه زهره خنده و نه یارای گفتار. گه عارضِ سیمینِ یکی را طپنچه زدی و گه ساقِ بلورینِ دیگری شکنجه کردی. القصه شنیدم که طرفی از خباثت نفس او معلوم کردند و بزدند و براندند و مکتب او را به مصلحی دادند پارسای سلیم نیک‌مرد حلیم که سخن جز به حکم ضرورت نگفتی و موجب آزار کس بر زبانش نرفتی. کودکان را هیبت استاد نخستین از سر برفت و معلم دومین را اخلاق مَلَکی دیدند و یک یک دیو شدند. به اعتماد حلم او ترک علم دادند. اغلب اوقات به بازیچه فرا هم نشستندی و لوح درست ناکرده در سر هم شکستندی. استاد معلم چو بود بی آزار
خرسک بازند کودکان در بازار بعد از دو هفته بر آن مسجد گذر کردم، معلم اولین را دیدم که دل‌خوش کرده بودند و به جای خویش آورده. انصاف برنجیدم و لاحول گفتم که ابلیس را معلم ملائکه دیگر چرا کردند. پیرمردی ظریف جهاندیده گفت: پادشاهی پسر به مکتب داد
لوح سیمینش بر کنار نهاد بر سر لوح او نبشته به زر
جور استاد به ز مهر پدر",7
"پارسازاده ای را نعمت بیکران از ترکه عمان به دست افتاد. فسق و فجور آغاز کرد و مبذری پیشه گرفت. فی‌الجمله نماند از سایر معاصی منکری که نکرد و مسکری که نخورد. باری به نصیحتش گفتم: ای فرزند! دخل آب روان است و عیش آسیای گردان یعنی خرج فراوان کردن مسلم کسی را باشد که دخل معین دارد. چو دخلت نیست خرج آهسته تر کن
که می‌گویند ملاحان سرودی اگر باران به کوهستان نبارد
به سالی دجله گردد خشک رودی عقل و ادب پیش گیر و لهو و لعب بگذار که چون نعمت سپری شود سختی بری و پشیمانی خوری. پسر از لذت نای و نوش این سخن در گوش نیاورد و بر قول من اعتراض کرد و گفت: راحت عاجل به تشویش محنت آجل منغص کردن خلاف رای خردمند است، خداوندان کام و نیکبختی
چرا سختی خورند از بیم سختی برو شادی کن ای یار دل افروز
غم فردا نشاید خورد امروز فکیف مرا که در صدر مروت نشسته باشم و عقد فتوت بسته و ذکر انعام در افواه عوام افتاده. هر که علم شد به سخا و کرم
بند نشاید که نهد بر درم نام نکویی چو برون شد به کوی
در نتوانی که ببندی به روی دیدم که نصیحت نمی‌پذیرد و دم گرم من در آهن سرد او اثر نمی‌کند. ترک مناصحت گرفتم و روی از مصاحبت بگردانیدم و قول حکما کار بستم که گفته‌اند: بلِّغ ما عَلیکَ فاِن لَم یَقبلوا ما عَلیکَ گرچه دانی که نشنوند بگوی
هر چه دانی ز نیکخواهی و پند زود باشد که خیره سر بینی
به دو پای اوفتاده اندر بند دست بر دست می زند که دریغ
نشنیدم حدیث دانشمند تا پس از مدتی آنچه اندیشه من بود از نکبت حالش به صورت بدیدم که پاره پاره به هم بر می‌دوخت و لقمه لقمه همی‌اندوخت. دلم از ضعف حالش به هم بر آمد و مروّت ندیدم در چنان حالی ریش درویش به ملامت خراشیدن و نمک پاشیدن. پس با دل خود گفتم: حریف سفله در پایان مستی
نیندیشد ز روز تنگدستی درخت اندر بهاران بر فشاند
زمستان لاجرم بی برگ ماند",7
"پادشاهی پسری را به ادیبی داد و گفت: این فرزند توست، تربیتش همچنان کن که یکی از فرزندان خویش. ادیب خدمت کرد و متقبل شد و سالی چند بر او سعی کرد و به جایی نرسید و پسران ادیب در فضل و بلاغت منتهی شدند. ملک دانشمند را مؤاخذت کرد و معاتبت فرمود که وعده خلاف کردی و وفا به جا نیاوردی. گفت: بر رای خداوند روی زمین پوشیده نماند که تربیت یکسان است و طباع مختلف. گرچه سیم و زر ز سنگ آید همی
در همه سنگی نباشد زر و سیم بر همه عالم همی‌تابد سهیل
جایی انبان میکند جایی ادیم",7
"یکی را شنیدم از پیران مربی که مریدی را همی‌گفت: ای پسر‌! چندان که تعلق خاطر آدمی‌زاد به روزی‌ست اگر به روزی‌ده بودی به مقام از ملائکه در‌گذشتی. فراموشت نکرد ایزد در آن حال
که بودی نطفهٔ مدفون و مدهوش روانت داد و طبع و عقل و ادراک
جمال و نطق و رای و فکرت و هوش ده انگشتت مرتب کرد بر کف
دو بازویت مرکب ساخت بر دوش کنون پنداری ای ناچیز همت‌!
که خواهد کردنت روزی فراموش‌؟",7
"اعرابیی را دیدم که پسر را همی‌گفت یا بُنَّی اِنَّک مسئولٌ یومَ القیامةِ ماذا اکتَسَبتَ و لا یُقالُ بمن انتسبتَ. یعنی تو را خواهند پرسید که عملت چیست نگویند پدرت کیست. جامه کعبه را که می بوسند
او نه از کرم پیله نامی شد با عزیزی نشست روزی چند
لاجرم همچنو گرامی شد",7
"در تصانیف حکما آورده‌اند که کژدم را ولادتِ معهود نیست چنانکه دیگر حیوانات را، بل احشای مادر را بخورند و شکمش را بدرند و راه صحرا گیرند و آن پوست‌ها که در خانه کژدم بینند اثر آن است. باری این نکته پیش بزرگی همی‌گفتم، گفت دل من بر صدق این سخن گواهی می‌دهد و جز چنین نتوان بودن، در حالت خردی با مادر و پدر چنین معاملت کرده‌اند لاجرم در بزرگی چنین مقبلند و محبوب! پسری را پدر وصیت کرد
کای جوانبخت یاد گیر این پند هر که با اهل خود وفا نکند
نشود دوست‌روی و دولتمند کژدم را گفتند: چرا به زمستان به در نمی‌آیی؟ گفت: به تابستانم چه حرمت است که به زمستان نیز بیایم؟!",7
"فقیره درویشی حامله بود، مدّت حمل بسر آورده و مر این درویش را همه عمر فرزند نیامده بود. گفت: اگر خدای عز ّو جل مرا پسری دهد، جز این خرقه که پوشیده دارم هر چه در ملک من است ایثار درویشان کنم. اتفاقاً پسر آورد و سفره درویشان به موجب شرط بنهاد. پس از چند سالی که از سفر شام باز آمدم به محلت آن دوست برگذشتم و از چگونگی حالش خبر پرسیدم. گفتند به زندان شحنه دَر است. سبب پرسیدم. کسی گفت: پسرش خمر خورده است و عربده کرده است و خون کسی ریخته و خود از میان گریخته، پدر را به علت او سلسله در نای است و بند گران بر پای. گفتم: این بلا را به حاجت از خدای عزّ و جل خواسته است! زنان باردار ای مرد هشیار
اگر وقت ولادت مار زایند از آن بهتر به نزدیک خردمند
که فرزندان ناهموار زایند",7
"طفل بودم که بزرگی را پرسیدم از بلوغ. گفت در مسطور آمده است که سه نشان دارد: یکی پانزده سالگی و دیگر احتلام و سیم بر آمدن موی پیش. اما در حقیقت یک نشان دارد و بس، آن که در بند رضای حق جلّ و علا بیش از آن باشی که در بند حظّ نفس خویش و هر آن که در او این صفت موجود نیست به نزد محققان بالغ نشمارندش. به صورت آدمی شد قطرهٔ آب
که چل روزش قرار اندر رحم ماند و گر چل ساله را عقل و ادب نیست
به تحقیقش نشاید آدمی خواند جوانمردی و لطف است آدمیت
همین نقش هیولانی مپندار هنر باید که صورت می توان کرد
به ایوان‌ها در از شنگرف و زنگار چو انسان را نباشد فضل و احسان
چه فرق از آدمی تا نقش دیوار به دست آوردن دنیا هنر نیست
یکی را گر توانی دل به دست آر",7
"سالی نزاعی در پیادگان حجیج افتاده بود و داعی در آن سفر هم پیاده. انصاف در سر و روی هم فتادیم و داد فسوق و جدال بدادیم. کجاوه‌نشینی را شنیدم که با عدیل خود می‌گفت: یاللعجب! پیادهٔ عاج چو عرصه شطرنج به سر می‌برد فرزین می‌شود، یعنی به از آن می‌گردد که بود و پیادگان حاج بادیه به سر بردند و بتر شدند. از من بگوی حاجی مردم گزای را
کاو پوستین خلق به آزار می‌درد حاجی تو نیستی شتر است از برای آنک
بیچاره خار می‌خورد و بار می‌برد",7
"هندویی نفط‌‌اندازی همی‌ آموخت. حکیمی گفت تو را که خانه نیین است، بازی نه این است. تا ندانی که سخن عین صواب است مگوی
وآنچه دانی که نه نیکوش جواب است مگوی",7
"مردکی را چشم درد خاست، پیش بیطار رفت که دوا کن. بیطار از آنچه در چشم چارپای می‌کند در دیده او کشید و کور شد. حکومت به داور بردند گفت بر او هیچ تاوان نیست. اگر این خر نبودی، پیش بیطار نرفتی. مقصود از این سخن آن است تا بدانی که هر آن که ناآزموده را کار بزرگ فرماید با آن که ندامت برد به نزدیک خردمندان به خفت رای منسوب گردد. ندهد هوشمند روشن‌رای
به فرومایه کارهای خطیر بوریاباف اگر چه بافنده‌ست
نبرندش به کارگاه حریر",7
"یکی را از بزرگان ائمه پسری وفات یافت. پرسیدند که بر صندوق گورش چه نویسیم؟ گفت: آیات کتاب مجید را عزت و شرف بیش از آن است که روا باشد بر چنین جایها نوشتن که به روزگار سوده گردد و خلایق بر او گذرند و سگان بر او شاشند. اگر به ضرورت چیزی همی‌نویسند این بیت کفایت است: وه که هر گه که سبزه در بستان
بدمیدی چه خوش شدی دل من بگذر ای دوست تا به وقت بهار
سبزه بینی دمیده بر گل من",7
"پارسایی بر یکی از خداوندان نعمت گذر کرد که بنده‌ای را دست و پای استوار بسته عقوبت همی‌کرد. گفت: ای پسر همچو تو مخلوقی را خدای عز ّو جل اسیر حکم تو گردانیده است و تو را بر وی فضیلت داده شکر نعمت باری تعالی به جای آر و چندین جفا بر وی مپسند، نباید که فردای قیامت به از تو باشد و شرمساری بری. بر بنده مگیر خشم بسیار
جورش مکن و دلش میازار او را تو به ده درم خریدی
آخر نه به قدرت آفریدی این حکم و غرور و خشم تا چند
هست از تو بزرگتر خداوند ای خواجهٔ ارسلان و آغوش
فرمانده خود مکن فراموش در خبر است از خواجهٔ عالم صلی الله علیه و سلم که گفت: بزرگترین حسرتی روز قیامت آن بود که یکی بندهٔ صالح را به بهشت برند و خواجهٔ فاسق را به دوزخ. بر غلامی که طوع خدمت توست
خشم بی حد مران و طیره مگیر که فضیحت بود به روز شمار
بنده آزاد و خواجه در زنجیر",7
"سالی از بلخ بامیانم سفر بود و راه از حرامیان پر خطر. جوانی به بدرقه همراه من شد، سپربازِ چرخ‌انداز، سلحشورِ بیش‌زور که به ده مردِ توانا کمانِ او زه کردندی و زورآورانِ رویِ زمین پشت او بر زمین نیاوردندی ولیکن چنان که دانی متنعم بود و سایه‌پرورده نه جهاندیده و سفر کرده. رعد کوس دلاوران به گوشش نرسیده و برق شمشیر سواران ندیده. نیفتاده بر دست دشمن اسیر
به گِردش نباریده باران تیر اتفاقاً من و این جوان هر دو در پی هم دوان. هر آن دیوار قدیمش که پیش آمدی به قوّت بازو بیفکندی و هر درخت عظیم که دیدی به زور سرپنجه بر کندی و تفاخرکنان گفتی: پیل کو تا کتف و بازوی گُردان بیند؟
شیر کو تا کف و سر پنجهٔ مردان بیند؟ ما در این حالت که دو هندو از پس سنگی سر بر آوردند و قصد قتال ما کردند. به دست یکی چوبی و در بغل آن دیگر کلوخ کوبی. جوان را گفتم: چه پایی؟ بیار آنچه داری ز مردی و زور
که دشمن به پای خود آمد به گور تیر و کمان را دیدم از دست جوان افتاده و لرزه بر استخوان. نه هر که موی شکافد به تیر جوشن‌خای
به روز حملهٔ جنگاوران بدارد پای چاره جز آن ندیدیم که رخت و سلاح و جامه‌ها رها کردیم و جان به سلامت بیاوردیم. به کارهای گران مرد کاردیده فرست
که شیر شرزه در آرد به زیر خمّ کمند جوان اگر چه قوی‌یال و پیلتن باشد
به جنگ دشمنش از هول بگسلد پیوند نبرد پیش مصاف‌آزموده معلوم است
چنان که مسألهٔ شرع پیش دانشمند",7
"توانگرزاده‌ای را دیدم بر سر گور پدر نشسته و با درویش‌بچه‌ای مناظره در پیوسته که: صندوق تربت ما سنگین است و کتابه رنگین و فرش رخام انداخته و خشت پیروزه در او به کار برده. به گور پدرت چه ماند‌؟ خشتی دو فراهم آورده و مشتی دو خاک بر آن پاشیده. درویش پسر این بشنید و گفت: تا پدرت زیر آن سنگ‌های گران بر خود بجنبیده باشد، پدر من به بهشت رسیده بود. خر که کمتر نهند بر وی بار
بی‌شک آسوده‌تر کند رفتار مرد درویش که بار ستم فاقه کشید
به در مرگ همانا که سبکبار آید وآن که در نعمت و آسایش و آسانی زیست
مردنش زین همه شک نیست که دشخوار آید به همه حال اسیری که ز بندی برهد
بهتر از حال امیری که گرفتار آید",7
"بزرگی را پرسیدم در معنی این حدیث که اَعدی عدوِّک نَفسُک الَّتی بینَ جَنبَیکَ. گفت: به حکم آن که هر آن دشمنی را که با وی احسان کنی دوست گردد مگر نفس را که چندان که مدارا بیش کنی مخالفت زیادت کند. فرشته‌خوی شود آدمی به کم خوردن
وگر خورد چو بهایم بیوفتد چو جماد مراد هر که برآری مطیع امر تو گشت
خلاف نفس که فرمان دهد چو یافت مراد",7
