hekayt,bab
"مشت‌زنی را حکایت کنند که از دهرِ مخالف به فغان آمده و حلقِ فراخ از دستِ تنگ به جان رسیده، شکایت پیشِ پدر بُرد و اجازت خواست که: عزمِ سفر دارم، مگر به قوَّتِ بازو دامنِ کامی فرا چنگ آرم. فضل و هنر ضایع است تا ننمایند
عود بر آتش نهند و مُشک بسایند پدر گفت: ای پسر! خیالِ مُحال از سر به‌دَر‌ کُن و پایِ قناعت در دامنِ سلامت کش که بزرگان گفته‌اند: دولت نه به کوشیدن است، چاره کم جوشیدن است. کس نتواند گرفت دامنِ دولت به زور
کوشش‌ِ بی‌فایده‌ست وَسْمه بر ابرویِ کور اگر به هر سرِ موییت صد خِرَد باشد
خِرَد به کار نیاید‌، چو بختْ بد باشد پسر گفت: ای پدر! فوایدِ سفر بسیار است؛ از نُزهَتِ خاطر و جَرِّ منافع و دیدنِ عجایب و شنیدنِ غرایب و تفرّجِ بُلْدان و مجاورتِ خُلّان و تحصیلِ جاه و ادب و مزیدِ مال و مُکتَسَب و معرفتِ یاران و تجرِبتِ روزگاران، چنانکه سالکانِ طریقت گفته‌اند: تا به دکّان و خانه درگِرَوی
هرگز ای خام‌، آدمی نشَوی برو اندر جهان تفرّج کن
پیش از آن روز کز جهان برَوی پدر گفت: ای پسر! منافعِ سفر چنین که گفتی بی‌شمار است ولیکن مُسَلَّم پنج طایفه راست: نخستین: بازرگانی که با وجودِ نعمت و مِکنَت، غلامان و کنیزان دارد دلاویز و شاگردانِ چابک. هر روز به شهری و هر شب به مَقامی و هر دم به تفرّجگاهی از نعیمِ دنیا مُتَمَتِّع. مُنْعِم به کوه و دشت و بیابان غریب نیست
هر جا که رفت خیمه زد و خوابگاه ساخت و‌آن را که بر مرادِ جهان نیست دسترس
در زاد‌و‌بومِ خویش غریب است و ناشناخت دوم: عالِمی که به منطقِ شیرین و قوّتِ فصاحت و مایهٔ بلاغت هر جا که روَد به خدمتِ او اِقدام نمایند و اِکرام کنند. وجودِ مردمِ دانا مثالِ زرِّ‌ طِلی‌ست
که هر کجا بروَد قدر و قیمتش دانند بزرگ‌زادهٔ نادان به شَهْرَوا مانَد
که در دیارِ غریبش به هیچ نستانند سِیُّم: خوبرویی که درونِ صاحب‌دلان به مخالطتِ او میل کند که بزرگان گفته‌اند: اندکیِ جمال به از بسیاریِ مال، و گویند: رویِ زیبا مرهمِ دل‌های خسته است و کلیدِ درهای بسته؛ لاجَرَم صحبتِ او را همه‌جای غنیمت شناسند و خدمتش را منّت دانند. شاهد آنجا که روَد، حرمت و عزّت بیند
ور برانند به قهرش پدر و مادر و خویش پرِ طاووس در اوراقِ مَصاحِف دیدم
گفتم: این مَنْزِلت از قدرِ تو می‌بینم بیش گفت: خاموش که هر کس که جَمالی دارد
هر کجا پای نهد، دست ندارندش پیش چون در پسر مُوافِقی و دلبری بوَد
اندیشه نیست، گر پدر از وی بَری بوَد او گوهر است‌، گو صدفش در جهان مباش
دُرِّ یتیم را همه‌کس مشتری بوَد چهارم: خوش‌آوازی که به حنجرهٔ داوودی آب از جَرَیان و مرغ از طَیَران باز‌دارد؛ پس به وَسیلتِ این فَضیلت، دلِ مشتاقان صید کند و اربابِ معنی به مُنادِمَتِ او رغبت نمایند و به انواع خدمت کنند. سَمْعی اِلیٰ حُسْنِ الْاَغانی
مَنْ ذَا الَّذی جَسَّ الْمَثانی؟ چه خوش باشد آهنگِ نرمِ حَزین
به گوشِ حریفانِ مستِ صَبوح به از رویِ زیباست آوازِ خوش
که آن حَظِّ نفس است و این قوتِ روح یا کمینه پیشه‌وری که به سعیِ بازو کَفافی حاصل کند تا آبروی از بهرِ نان ریخته نگردد، چنان که خردمندان گفته‌اند: گر به غریبی روَد از شهرِ خویش
سختی و محنت نبَرَد پینه‌دوز ور به خرابی فتَد از مملکت
گُرسَنه خفتَد مَلِکِ نیمروز چنین صفت‌ها که بیان کردم، ای فرزند، در سفر موجبِ جمعیّتِ خاطر است و داعیهٔ طِیبِ عیش. و آن‌که از این جمله بی‌بهره است، به خیالِ باطل در جهان بروَد و دیگر کسش نام و نشان نشنود. هر آن که گردشِ گیتی به کینِ او برخاست
به غیرِ مصلحتش رهبری کند ایّام کبوتری که دگر آشیان نخواهد دید
قضا همی‌بَرَدش تا به سویِ دانهٔ دام پسر گفت: ای پدر! قولِ حکَما را چگونه مخالفت کنیم؟ که گفته‌اند: رزق اگرچه مقسوم است‌، به اسباب‌ِ حُصول‌، تعلّقْ شرط است و بلا اگرچه مقدور، از ابواب‌ِ دخولِ آن احتراز واجب. رزق اگر‌چند بی‌گمان برسد
شرطِ عقل است، جُستن از درها ورچه کس بی‌اجل نخواهد مُرد
تو مرو در دهانِ اژدرها در این صورت که منم با پیلِ دَمان بزنم و با شیرِ ژیان پنجه در‌افکنم؛ پس مصلحت آن است ای پدر، که سفر کنم کز این بیش طاقتِ بینوایی نمی‌آرم. چون مرد درفتاد ز جای و مقامِ خویش
دیگر چه غم خورَد؟ همه آفاق جایِ اوست شب هر توانگری به سرایی همی‌روند
درویش هرکجا که شب آمد، سرایِ اوست این بگفت و پدر را وداع کرد و همّت خواست و روان شد و با خود همی‌گفت: هنروَر چو بختش نباشد به کام
به جایی روَد کش ندانند نام همچنین تا برسید به کنارِ آبی که سنگ از صلابتِ او بر سنگ همی‌آمد و خروش به فرسنگ می‌رفت. سهمگن آبی که مرغابی در او ایمن نبودی
کمترین موج، آسیا‌سنگ از کنارش در‌رُبودی گروهی مردمان را دید هر یک به قراضه‌ای در معبر نشَسته و رختِ سفر بسته. جوان را دستِ عطا بسته بود، زبانِ ثنا برگشود؛ چندان که زاری کرد یاری نکردند. ملّاحِ بی‌مروَّت به خنده برگردید و گفت: زر نداری نتوان رفت به زور از دریار
زور‌ِ دَه‌مَرده چه باشد‌؟ زرِ یک‌مَرده بیار‌! جوان را دل از طعنهٔ ملّاح به‌هم برآمد، خواست که از او انتقام کَشد، کَشتی رفته بود. آواز داد و گفت: اگر بدین جامه که پوشیده دارم قناعت کنی، دریغ نیست. ملّاح طمع کرد و کَشتی بازگردانید. بدوزد شَرَه‌، دیدهٔ هوشمند
در‌آرَد طمع‌، مرغ و ماهی به بند چندان که ریش و گریبان به دستِ جوان افتاد، به خود درکشید و بی‌مُحابا کوفتن گرفت. یارش از کَشتی به‌در‌آمد تا پشتی کند؛ همچنین درشتی دید و پشت بداد. جز این چاره نداشتند که با او به مصالحت گرایند و به اجرت مُسامحت نمایند؛ کُلُّ مُدٰاراةٍ صَدَقَةٌ. چو پرخاش بینی تحمّل بیار
که سهلی ببندد درِ کارزار به شیرین‌زبانیّ و لطف و خوشی
توانی که پیلی به مویی کشی به عذرِ ماضی در قدمش فتادند و بوسهٔ چندی به نفاق بر سر و چشمش دادند؛ پس به کَشتی درآوردند و روان شدند تا برسیدند به ستونی از عمارتِ یونان در آب ایستاده. ملّاح گفت: کَشتی را خَلَل هست؛ یکی از شما که دلاور‌تر است باید که بدین ستون بروَد و خِطامِ کَشتی بگیرد تا عمارت کنیم. جوان به غرورِ دلاوری که در سر داشت، از خصمِ دل‌آزرده نیندیشید و قولِ حکما که گفته‌اند: هر که را رنجی به دل رسانیدی، اگر در عقبِ آن صد راحت برسانی، از پاداشِ آن یک رنجش ایمن مباش، که پیکان از جراحت به‌درآید و آزار در دل بمانَد. چه خوش گفت بَکْتاش با خَیْل‌ْتاش
چو دشمن خراشیدی، ایمن مباش مشو ایمن، که تَنگ‌دل گَردی
چون ز دستت دلی به تَنگ آید سنگ بر بارهٔ حصار مزن
که بوَد کز حصار سنگ آید چندان که مِقْوَدِ کَشتی به ساعد برپیچید و بالایِ ستون رفت، ملّاح زِمام از کَفَش درگسلانید و کَشتی براند. بیچاره متحیّر بماند. روزی دو بلا و محنت کشید و سختی دید. سِیُّم خوابش گریبان گرفت و به آب انداخت. بعدِ شبانروزی دگر بر کنار افتاد، از حیاتش رمقی مانده. برگِ درختان خوردن گرفت و بیخِ گیاهان برآوردن، تا اندکی قوَّت یافت. سر در بیابان نهاد و همی‌رفت تا تشنه و بی‌طاقت به سرِ چاهی رسید، قومی بر او گِرد آمده و شربتی آب به پشیزی همی‌آشامیدند. جوان را پشیزی نبود. طلب کرد و بیچارگی نمود، رحمت نیاوردند. دستِ تعدّی دراز کرد، میسَّر نشد. به ضرورت تنی چند را فروکوفت، مردان غلبه کردند و بی‌محابا بزدند و مجروح شد. پشّه چو پُر شد، بزند پیل را
با همه تندی و صلابت که اوست مورچگان را چو بوَد اتّفاق
شیرِ ژیان را بدرانند پوست به حکمِ ضرورت در پیِ کاروانی افتاد و برَفت؛ شبانگه برسیدند به مقامی که از دزدان پرخطر بود. کاروانیان را دید لرزه بر اندام اوفتاده و دل بر هلاک نهاده. گفت: اندیشه مدارید که یکی منم در این میان که به تنها پنجاه مَرد را جواب دهم و دیگر جوانان هم یاری کنند. این بگفت و مردمِ کاروان را به لافِ او دل قوی گشت و به صحبتش شادمانی کردند و به زاد و آبش دستگیری واجب دانستند. جوان را آتشِ معده بالا گرفته بود و عنانِ طاقت از دست رفته؛ لقمه‌ای چند از سرِ اشتها تناول کرد و دَمی چند آب در سَرش آشامید تا دیوِ درونش بیارمید و بخفت. پیرمردی جهان‌دیده در آن میان بود. گفت: ای یاران! من از این بدرقهٔ شما اندیشناکم، نه چندان که از دزدان؛ چنان که حکایت کنند که عربی را دِرَمی چند گِرد آمده بود و به شب از تشویشِ لوریان در خانه تنها خوابش نمی‌برد؛ یکی را از دوستان پیشِ خود آورد تا وحشتِ تنهایی به دیدارِ او منصرف کُند و شبی چند در صحبتِ او بود. چندان که بر درم‌هاش اطّلاع یافت، ببُرد و بخورد و سفر کرد. بامدادان دیدند عرب را گریان و عریان. گفتند: حال چیست؟ مگر آن درم‌های تو را دزد بُرد؟ گفت: لٰا وَللّهِ! بدرقه بُرد. هرگز ایمن ز مار ننشستم
که بدانستم آنچه خصلتِ اوست زخمِ دندانِ دشمنی بَتَر است
که نماید به چشمِ مردم، دوست چه دانید اگر این هم از جملهٔ دزدان باشد که به عیّاری در میانِ ما تعبیه شده است تا به وقتِ فرصت یاران را خبر کند‌؟ مصلحت آن بینم که مر او را خفته بمانیم و برانیم. جوانان را تدبیرِ پیر استوار آمد و مهابتی از مشت‌زن در دل گرفتند و رخت برداشتند و جوان را خفته بگذاشتند. آن‌گه خبر یافت که آفتابش در کتف تافت؛ سَر برآورد و کاروان رفته دید. بیچاره بسی بگردید و ره به جایی نبُرد؛ تشنه و بی‌نوا روی بر خاک و دل بر هلاک نهاده همی‌گفت: مَنْ ذٰا یُحَدِّثُنی وَ زُمَّ الْعیسُ
مٰا لِلْغریبِ سِوَیَ الْغَریبِ اَنیسُ درشتی کند با غریبان کسی
که نابوده باشد به غربت بسی مسکین در این سخن بود که پادشه‌پسری به صید از لشکریان دورافتاده بود، بالای سرش ایستاده، همی‌شنید و در هیأتش نگه می‌کرد، صورتِ ظاهرش پاکیزه و صورتِ حالش پریشان؛ پرسید: از کجایی و بدین جایگه چون افتادی؟ برخی از آنچه بر سرِ او رفته بود اعادت کرد. ملک‌زاده را بر حالِ تباهِ او رحمت آمد؛ خلعت و نعمت داد و معتمدی با وی فرستاد تا به شهرِ خویش آمد. پدر به دیدارِ او شادمانی کرد و بر سلامتِ حالش شُکر گفت. شبانگه ز آنچه بر سرِ او گذشته بود: از حالتِ کَشتی و جورِ ملّاح و روستایان بر سرِ چاه و غدرِ کاروانیان با پدر می‌گفت. پدر گفت: ای پسر! نگفتمت هنگامِ رفتن که تهیدستان را دستِ دلیری بسته است و پنجهٔ شیری شکسته؟ چه خوش گفت آن تهی‌دستِ سلحشور:
جویِ زر بهتر از پنجاه من زور. پسر گفت: ای پدر! هر آینه تا رنج نبَری، گنج برنداری و تا جان در خطر ننهی بر دشمن ظفر نیابی و تا دانه پریشان نکُنی خرمن برنگیری؛ نه بینی به اندک‌مایه رنجی که بردم چه تحصیلِ راحت کردم و به نیشی که خوردم چه مایه عسل آوردم؟ گرچه بیرون ز رزق نتوان خوَرد
در طلب کاهلی نشاید کرد غوّاص اگر اندیشه کند کامِ نهنگ
هرگز نکند دُرِّ گرانمایه به چنگ آسیا‌سنگِ زیرین متحرّک نیست، لاجَرَم تحمّلِ بارِ گران همی‌کند. چه خورَد شیرِ شَرزه در بنِ غار؟
بازِ افتاده را چه قوت بوَد؟ تا تو در خانه صید خواهی کرد
دست و پایت چو عنکبوت بوَد پدر گفت: ای پسر! تو را در این نوبت فلک یاوری کرد و اقبال رهبری، که صاحب‌دولتی در تو رسید و بر تو ببخشایید و کسرِ حالت را به تفقّدی جَبر کرد و چنین اتّفاق نادر افتد و بر نادر حکم نتوان کرد؛ زنهار تا بدین طمع دگرباره گِردِ ولع نگردی. صیّاد نه هر بار شَگالی ببَرَد
افتد که یکی روز پلنگش بخورَد چنان که یکی را از ملوکِ پارس نگینی گرانمایه بر انگشتری بود، باری به حکمِ تفرّج با تنی چند خاصّان به مصلّایِ شیراز برون رفت. فرمود تا انگشتری را بر گنبدِ عَضُد نصب کردند تا هر که تیر از حلقهٔ انگشتری بگذراند، خاتم او را باشد. اتّفاقاً چهارصد حُکم‌انداز که در خدمتِ او بودند جمله خطا کردند، مگر کودکی بر بام رباطی که به بازیچه تیر از هر طرفی می‌انداخت؛ بادِ صبا تیرِ او را به حلقهٔ انگشتری دربگذرانید و خلعت و نعمت یافت و خاتم به وی ارزانی داشتند. پسر تیر و کمان را بسوخت. گفتند: چرا کردی؟ گفت: تا رونقِ نخستین بر جای مانَد. گه بوَد کز حکیمِ روشن‌رای
برنیاید درست تدبیری گاه باشد که کودکی نادان
به غلط بر هدف زنَد تیری",3
"درویشی را شنیدم که به غاری در نشسته بود و در به روی از جهانیان بسته و ملوک و اغنیا را در چشمِ همّتِ او شوکت و هیبت نمانده. هر که بر خود درِ سؤال گشاد
تا بمیرد، نیازمند بوَد آز بگذار و پادشاهی کن
گردنِ بی‌طمع بلند بوَد یکی از ملوک آن طرف اشارت کرد که توقّع به کرمِ اخلاقِ مردان چنین است که به نمک با ما موافقت کنند. شیخ رضا داد، به حکمِ آن که اِجابتِ دعوت، سنّت است. دیگر روز مَلِک به عذرِ قدومش رفت. عابد از جای برجَست و در کنارش گرفت و تلطُّف کرد و ثَنا گفت. چو غایب شد، یکی از اصحاب پرسید شیخ را که: چندین ملاطفت امروز با پادشه که تو کردی، خلافِ عادت بود و دیگر ندیدیم‌. گفت نشنیده‌ای که گفته‌اند: هر که را بر سِماط بنشَستی
واجب آمد، به خدمتش برخاست گوش تواند که همه عمر وی
نشنوَد آوازِ دف و چنگ و نی دیده شکیبد ز تماشایِ باغ
بی گل و نسرین به سر آرَد دِماغ ور نبوَد بالش‌ِ آکنده پَر
خواب توان کرد، خَزَف زیرِ سَر ور نبوَد دلبرِ همخوابه پیش
دست توان کرد در آغوشِ خویش وین شکمِ بی‌هنر‌ِ پیچ‌پیچ
صبر ندارد که بسازد به هیچ",3
"یکی را از دوستان گفتم: امتناع سخن گفتنم به علّتِ آن اختیار آمده است در غالبِ اوقات، که در سخنْ نیک و بد اتّفاق افتد و دیدهٔ دشمنان جز بر بدی نمی‌آید. گفت: دشمن آن به که نیکی نبیند. وَ اَخُو الْعَداوَةِ لا یَمُرُّ بِصالِحٍ
اِلّا وَ یَلْمُزُهُ بِکَذّابٍ اَشِرْ هنر به چشم عداوت بزرگتر عیب است
گل است سعدی و در چشم دشمنان خار است نورِ گیتی‌فروزِ چشمهٔ هور
زشت باشد به چشمِ موشکِ کور",4
"بازرگانی را هزار دینار خسارت افتاد. پسر را گفت: نباید که این سخن با کسی در میان نهی. گفت: ای پدر! فرمان تو راست، نگویم، ولکن خواهم مرا بر فایدهٔ این مطلع گردانی که: مصلحت در نهان داشتن چیست؟ گفت: تا مصیبت دو نشود؛ یکی نقصانِ مایه و دیگر شماتتِ همسایه. مگوی اندُهِ خویش با دشمنان
که لاحَوْل گویند شادی‌کنان",4
"جوانی خردمند از فنونِ فضایل حظّی وافر داشت و طبعی نافر. چندانکه در محافلِ دانشمندان نشستی، زبان سخن ببستی. باری پدرش گفت: ای پسر! تو نیز آنچه دانی، بگوی. گفت: ترسم که بپرسند از آنچه ندانم و شرمساری برم. نشنیدی که صوفی‌یی می‌کوفت
زیرِ نعلینِ خویش میخی چند؟ آستینش گرفت سرهنگی
که: بیا نعل بر ستورم بند",4
"عالمی معتبر را مناظره افتاد با یکی از مَلاحده، لَعَنَهُمُ اللهُ عَلیٰ حِدَةٍ، و به حجّت با او بس نیامد؛ سپر بینداخت و برگشت. کسی گفتش: تو را با چندین فضل و ادب که داری، با بی‌دینی حجّت نماند؟ گفت: علمِ من قرآن است و حدیث و گفتارِ مشایخ و او بدینها معتقد نیست و نمی‌شنود؛ مرا شنیدنِ کفرِ او به چه کار می‌آید؟ آن کس که به قرآن و خبر زو نرهی
آن است جوابش که: جوابش ندهی",4
"جالینوس ابلهی را دید دست در گریبان دانشمندی زده و بی‌حرمتی همی‌کرد. گفت: اگر این نادان نبودی، کارِ وی با نادانان بدینجا نرسیدی. دو عاقل را نباشد کین و پیکار
نه دانایی ستیزد با سبکسار اگر نادان به وحشت سخت گوید
خردمندش به نرمی دل بجوید دو صاحبدل نگه دارند مویی
همیدون سرکشی و آزرم‌جویی و گر بر هر دو جانب جاهلانند
اگر زنجیر باشد، بگسلانند یکی را زشت‌خویی داد دشنام
تحمّل کرد و گفت: ای خوب فرجام بتر زآنم که خواهی گفتن، آنی
که دانم، عیب من چون من ندانی",4
"سَحْبانِ وائِل را در فصاحت بی‌نظیر نهاده‌اند، به حکمِ آنکه بر سرِ جمع، سالی سخن گفتی؛ لفظی مکرّر نکردی وگر همان اتفاق افتادی به عبارتی دیگر بگفتی. وز جملهٔ آدابِ نُدَماءِ ملوک یکی این است: سخن گرچه دلبند و شیرین بود
سزاوارِ تصدیق و تحسین بود چو یک بار گفتی، مگو باز پس
که حلوا چو یک بار خوردند، بس",4
"یکی را از حکما شنیدم که می‌گفت: هرگز کسی به جهلِ خویش اقرار نکرده است مگر آن کس که چون دیگری در سخن باشد، همچنان ناتمام گفته، سخن آغاز کند. سخن را سر است اى خردمند و بُن
میاور سخن در میانِ سخُن خداوندِ تدبیر و فرهنگ و هوش
نگوید سخن، تا نبیند خموش",4
"تنی چند از بندگانِ محمود گفتند حسنِ میمندی را که: سلطان امروز تو را چه گفت در فلان مصلحت؟ گفت: بر شما هم پوشیده نباشد. گفتند: آنچه با تو گوید، به امثالِ ما گفتن روا ندارد. گفت: به اعتمادِ آن که داند که نگویم، پس چرا همی‌پرسید؟ نه هر سخن که برآید، بگوید اهلِ شناخت
به سرِّ شاه سر خویشتن نشاید باخت",4
"در عقدِ بَیْع سرایی مُتَرَدِّد بودم. جهودی گفت: آخر من از کدخدایانِ این محلّتم؛ وصفِ این خانه چنان که هست از من پرس. بخر که هیچ عیبی ندارد. گفتم: به جز آن که تو همسایهٔ منی! خانه‌ای را که چون تو همسایه است
ده درم سیمِ بد عیار ارزد لکن امّیدوار باید بود
که پس از مرگِ تو هزار ارزد",4
"یکی از شعرا پیشِ امیرِ دزدان رفت و ثَنایی بر او بگفت. فرمود تا جامه از او بَرکنَند و از ده به در کنند. مسکین برهنه به سرما همی‌رفت. سگان در قفایِ وی افتادند. خواست تا سنگی بردارد و سگان را دفع کند، در زمین یخ گرفته بود؛ عاجز شد. گفت: این چه حرامزاده مردمانند؛ سگ را گشاده‌اند و سنگ را بسته! امیر از غرفه بدید و بشنید و بخندید. گفت: ای حکیم! از من چیزی بخواه. گفت: جامهٔ خود می‌خواهم، اگر انعام فرمایی. رَضینٰا مِنْ نَوالِکَ بِالرَّحیلِ. امیدوار بوَد آدمى به خیرِ کسان
مرا به خیرِ تو امّید نیست، شر مرسان سالارِ دزدان را بر او رحمت آمد و جامه باز فرمود و قبا پوستینی بر او مزید کرد و دِرَمی چند.",4
"منجّمی به خانه در آمد، یکی مردِ بیگانه را دید با زنِ او به هم نشسته. دشنام و سقط گفت و فتنه و آشوب خاست. صاحبدلی که بر این واقف بود، گفت: تو بر اوجِ فلک چه دانى چیست؟
که ندانى که در سرایت کیست؟",4
