hekayt,bab
"یکی را از بزرگان به محفلی‌اندر همی‌ستودند و در اوصافِ جمیلش مبالغه می‌کردند. سر بر آورد و گفت: من آنم که من دانم. کَفَیْتَ اَذَیً یا مَنْ یَعُدُّ مَحاسِنی
عَلانِیَتی هَذٰاٰ وَلَمْ تَدْرِ ما بَطَنْ شخصم به چشمِ عالمیان خوب‌منظر است
وز خُبْثِ باطنم سرِ خجلت فتاده پیش طاووس را به نقش و نگاری که هست، خلق 
تحسین کنند و او خجل از پای زشتِ خویش",2
"یکی از صُلَحایِ لبنان که مَقاماتِ او در دیارِ عرب مذکور بود و کرامات مشهور، به جامعِ دِمشق در آمد و بر کنار بِرکهٔ کَلّاسه طهارت همی‌ساخت؛ پایش بلغزید و به حوض در افتاد و به مشقّت از آن جایگه خلاص یافت. چون از نماز بپرداختند یکی از اصحاب گفت: مرا مشکلی هست؛ اگر اجازتِ پرسیدن است. گفت: آن چیست؟ گفت: یاد دارم که شیخ به روی دریایِ مغرب برفت و قدمش تر نشد، امروز چه حالت بود که در این قامتی آب از هلاک چیزی نماند؟! شیخ اندر این فکرت فرو رفت و پس از تأمّلِ بسیار سر بر آورد و گفت: نشنیده‌ای که خواجهٔ عالم عَلَیْهِ السَّلامُ گفت: «لی مَعَ اللهِ وَقْتٌ لا یَسَعُنی فیهِ مَلَکٌ مُقَرَّبٌ وَ لا نَبِیٌ مُرْسَلٌ». و نگفت «عَلَی الدَّوامِ»؟ وقتی چنین که فرمود، به جِبْرَئیل و میکائیل نپرداختی و دیگر وقت با حَفْصه و زینب در ساختی. مُشاهَدَةُ الاَبْرارَ بَیْنَ التَّجَلّی وَ اْلاِسْتِتارِ. می‌نمایند و می‌ربایند. دیدار می‌نمایی و پرهیز می‌کنی
بازارِ خویش و آتشِ ما تیز می‌کنی اُشاهِدُ مَنْ اَهْویٰ بِغَیْرِ وَسیلَةٍ 
فَیَلْحَقُنی شَأْنٌ اَضلُّ طَریقاً",2
"یکی پرسید از آن گم‌کرده‌فرزند
که ای روشن‌گُهر پیرِ خردمند ز مصرش بویِ پیراهن شنیدی
چرا در چاهِ کَنْعانش ندیدی؟! بگفت: احوالِ ما برقِ جهان است
دمی پیدا و دیگر دم نهان است گهی بر طارَمِ اعلیٰ نشینیم
گهی بر پشتِ پایِ خود نبینیم اگر درویش در حالی بماندی
سرِ دست از دو عالم برفشاندی",2
"در جامع بَعْلَبَکَّ وقتی کلمه‌ای همی‌گفتم به طریقِ وعظ با جماعتی افسرده، دل مرده، ره از عالمِ صورت به عالمِ معنی نبرده. دیدم که نفسم در نمی‌گیرد و آتشم در هیزمِ تر اثر نمی‌کند. دریغ آمدم تربیتِ سُتوران و آینه‌داری در محلّتِ کوران. ولیکن دَرِ معنی باز بود و سلسلهٔ سخن دراز. در معانیِ این آیت که: «و نَحْنُ اَقْرَبُ اِلَیْهِ مِنْ حَبْلِ الْوَریدِ». سخن به جایی رسانیده که گفتم: دوست نزدیکتر از من به من است
وینت مشکل که من از وی دورم چه کنم با که توان گفت؟: که او 
در کنارِ من و من مهجورم من از شرابِ این سخن مست و فُضالهٔ قَدَح در دست، که رونده‌ای بر کنارِ مجلس گذر کرد و دورِ آخر در او اثر کرد و نعره‌ای زد که دیگران به موافقتِ او در خروش آمدند و خامانِ مجلس به جوش. گفتم: ای سُبْحانَ اللهِ! دورانِ باخبر در حضور و نزدیکانِ بی‌بَصَر دور! فهمِ سخن چون نکند مُستمِع
قوّتِ طبع از متکلّم مجوی فُسْحَتِ میدانِ ارادت بیار 
تا بزند مردِ سخنگوی، گوی",2
"شبی در بیابانِ مکّه از بی‌خوابی پایِ رفتنم نماند؛ سر بنهادم و شتربان را گفتم: دست از من بدار. پایِ مسکینْ پیاده چند رود؟
کز تحمّل ستوه شد بُختی تا شود جسمِ فربهی لاغر 
لاغری مرده باشد از سختی گفت: ای برادر! حرم در پیش است و حرامیّ در پس؛ اگر رفتی بُردی، وگر خفتی، مُردی. خوش است زیرِ مُغیلان به راه بادیه خُفت 
شبِ رَحیل. ولی ترکِ جان بباید گفت",2
"پارسایی را دیدم بر کنارِ دریا که زخمِ پلنگ داشت و به هیچ دارو بِه نمی‌شد. مدّتها در آن رنجور بود و شکر خدای، عَزَّوَجَّلَ، عَلَی‌الدَّوام گفتی. پرسیدندش که شکر چه می‌گویی؟ گفت: شکر آن که به مصیبتی گرفتارم نه به معصیتی. گر مرا زار به کشتن دهد آن یارِ عزیز 
تا نگویی که در آن دم غمِ جانم باشد گویم: از بندهٔ مسکین چه گنه صادر شد 
کاو دل آزرده شد از من؟ غمِ آنم باشد",2
"درویشی را ضَرورتی پیش آمد، گلیمی از خانهٔ یاری بدزدید. حاکم فرمود که دستش بدر کنند. صاحبِ گلیم شَفاعت کرد که: من او را بِحِل کردم. گفتا: به شفاعتِ تو حدّ شَرعْ فرو نگذارم. گفت: آنچه فرمودی، راست گفتی، ولیکن هر که از مالِ وقف چیزی بدزدد، قطعش لازم نیاید، وَ الْفقیرُ لایَمْلِکُ. هر چه درویشان راست؛ وقفِ محتاجان است. حاکم دست از او بداشت و ملامت کردن گرفت که: جهان بر تو تنگ آمده بود که دزدی نکردی الّا از خانهٔ چنین یاری!؟ گفت: ای خداوند! نشنیده‌ای که گویند: خانهٔ دوستان بروب و درِ دشمنان مکوب. چون به سختی در بمانی تن به عجز اندر مده
دشمنان را پوست بر کن، دوستان را پوستین",2
"پادشاهی پارسایی را دید. گفت: هیچت از ما یاد آید؟ گفت: بلی! وقتی که خدا را فراموش می‌کنم. هر سو دَوَد آن کَش ز برِ خویش براند 
وآن را که بخواند به درِ کس ندواند",2
"یکی از جملهٔ صالحان به خواب دید پادشاهی را در بهشت و پارسایی در دوزخ. پرسید که موجبِ درجاتِ این چیست و سبب دَرَکاتِ آن؟ که مردم به خلاف این معتقد بودند. ندا آمد که این پادشه به ارادتِ درویشان به بهشت اندر است و این پارسا به تقرّبِ پادشاهان در دوزخ. دَلْقت به چه کار آید و مِسْحیّ و مُرَقَّع 
خود را ز عمل‌هایِ نکوهیده بری دار حاجت به کلاهِ بَرَکی داشتنت نیست 
درویش‌صفت باش و کلاهِ تَتَری دار",2
"پیاده‌ای سر و پا برهنه با کاروانِ حجاز از کوفه به در آمد و همراهِ ما شد و معلومی نداشت؛ خرامان همی‌رفت و می‌گفت: «نه به اَسْتَر بَر، سوارم نه چو اشتر زیر بارم 
نه خداوندِ رعیّت نه غلامِ شهریارم غمِ موجود و پریشانیِ مَعدوم ندارم
نفسی می‌زنم آسوده و عمری می‌گذارم» اشتر سواری گفتش: ای درویش کجا می‌روی؟! برگرد که به سختی بمیری. نشنید و قدم در بیابان نهاد و برفت. چون به نَخْلهٔ محمود در رسیدیم، توانگر را اجل فرا رسید. درویش به بالینش فراز آمد و گفت: «ما به سختی بنمردیم و تو بر بُختی بمردی.» شخصی همه شب بر سرِ بیمار گریست 
چون روز بشد، بمرد و بیمار بزیست ای بسا اسبِ تیزرو که بماند 
که خرِ لنگْ جان به منزل برد بس که در خاک تندرستان را 
دفن کردیم و زخم‌خورده نمرد",2
"عابدی را پادشاهی طلب کرد. اندیشید که دارویی بخورم تا ضعیف شوم، مگر اعتقادی که دارد در حقِّ من زیادت کند. آورده‌اند که داروی قاتل بخورد و بمرد. آن که چون پسته دیدمش همه مغز 
پوست بر پوست بود همچو پیاز پارسایانِ رویْ در مخلوق 
پشت بر قبله، می‌کنند نماز چون بنده خدایِ خویش خوانَد 
باید که به جز خدا نداند",2
"کاروانی در زمین یونان بزدند و نعمتِ بی‌قیاس ببردند. بازرگانان گریه و زاری کردند و خدا و پیمبر شَفیع آوردند و فایده نبود. چو پیروز شد دزدِ تیره‌روان
چه غم دارد از گریهٔ کاروان؟! لقمان حکیم اندر آن کاروان بود. یکی گفتش از کاروانیان: مگر اینان را نصیحتی کنی و موعظه‌ای گویی تا طرفی از مالِ ما دست بدارند که دریغ باشد چندین نعمت که ضایع شود. گفت: دریغ کلمهٔ حکمت با ایشان گفتن. آهنی را که موریانه بخورد
نتوان برد از او به صِیقَل زنگ با سیه‌دل چه سود گفتن وعظ؟
نرود میخِ آهنی، در سنگ همانا که جرم از طرف ماست. به روزگارِ سلامت، شکستگان دریاب
که جبرِ خاطرِ مسکین بلا بگرداند چو سائل از تو به زاری طلب کند چیزی
بده وگرنه ستمگر به زور بستاند",2
"چندان‌که مرا شیخِ اَجَلّ، ابوالفرج بن جوزی، رَحْمَةُ اللهِ عَلَیْهِ، ترکِ سَماع فرمودی و به خلوت و عُزلت اشارت کردی، عُنْفُوانِ شَبابم غالب آمدی و هوا و هوس طالب؛ ناچار به خلافِ رایِ مربّی قدمی برفتمی و از سماع و مُجالست حَظّی برگرفتمی و چون نصیحتِ شیخم یاد آمدی، گفتمی: قاضی ار با ما نشیند، برفشاند دست را
محتسِب گر مَی خورد، معذور دارد مست را تا شبی به مَجْمَعِ قومی برسیدم که در میان مطربی دیدم؛ گویی رگِ جان می‌گسلد زخمهٔ ناسازش
ناخوش‌تر از آوازهٔ مرگِ پدر، آوازش گاهی انگشت حریفان از او در گوش و گهی بر لب که خاموش! نُهاجُ اِلیٰ صَوْتِ اْلاَغانی لِطیبِها
وَ اَنْتَ مُغَنٍّ اِنْ سَکَتَّ نَطیبُ نبیند کسی در سَماعت خوشی
مگر وقتِ رفتن که دَم در کشی چون در آواز آمد آن بَرْبَط سرای
کدخدا را گفتم: از بهر خدای زَیْبَقم در گوش کُن تا نشنوم
یا دَرَم بگشای تا بیرون روم فی‌الجمله پاسِ خاطر یاران را موافقت کردم و شبی به چند مُجاهده به روز آوردم. مؤذّن بانگِ بی‌هنگام برداشت
نمی‌داند که چند از شب گذشته است درازیِّ شب از مژگانِ من پرس
که یک‌دم خواب در چشمم نگشته است بامدادان به حکم تّبرکْ دستاری از سر و دیناری از کمر بگشادم و پیش مُغَنّی نهادم و در کنارش گرفتم و بسی شکر گفتم. یاران ارادتِ من در حقّ او خلافِ عادت دیدند و بر خِفَّتِ عقلم حمل کردند. یکی زآن میان زبان تعرّض دراز کرد و ملامت کردن آغاز، که این حرکت مناسب رایِ خردمندان نکردی؛ خرقهٔ مَشایخ به چنین مطربی دادن که در همه عمرش درمی ‌بر کف نبوده است و قُراضه‌ای در دف. مطربی، دور از این خجسته سرای
کس دو بارش ندیده در یک جای راست چون بانگش از دهن برخاست
خلق را موی بر بدن برخاست مرغِ ایوان ز هولِ او بپرید
مغز ما برد و حلقِ خود بدرید گفتم: زبانِ تعرّض مصلحت آن است که کوتاه کنی که مرا کرامتِ این شخص ظاهر شد. گفت: مرا بر کیفیّتِ آن واقف نگردانی تا منش هم تقرّب کنم و بر مطایبتی که کردم استغفار گویم؟ گفتم: بلی! به علّتِ آن که شیخِ اَجَلّم بارها به ترکِ سَماع فرموده است و موعظهٔ بلیغ گفته و در سمعِ قبول من نیامده. امشبم طالعِ مَیْمون و بختِ همایون بدین بُقعه رهبری کرد تا به دست این توبه کردم که بقیّتِ زندگانی گِردِ سَماع و مخالطت نگردم! آواز خوش از کام و دهان و لبِ شیرین
گر نغمه کند ور نکند دل بفریبد ور پردهٔ عُشّاق و خراسان و حجاز است
از حنجرهٔ مطربِ مکروه نزیبد",2
"لقمان را گفتند: ادب از که آموختی؟ گفت: از بی ادبان؛ هر چه از ایشان در نظرم ناپسند آمد از فعلِ آن پرهیز کردم. نگویند از سر بازیچه حرفی
کز آن پندی نگیرد صاحبِ هوش و گر صد بابِ حکمت پیشِ نادان
بخوانند، آیدش بازیچه در گوش",2
"عابدی را حکایت کنند که شبی ده مَن طعام بخوردی و تا سحر خَتْمی در نماز بکردی. صاحبدلی شنید و گفت: اگر نیم نانی بخوردی و بخفتی، بسیار از این فاضل‌تر بودی. اندرون از طعام خالی دار
تا در او نورِ معرفت بینی تهی از حکمتی به علّتِ آن
که پُری از طعام تا بینی",2
"بخشایِشِ الهی گم‌شده‌ای را در مَناهی، چراغِ توفیق فرا راه داشت تا به حلقهٔ اهلِ تحقیق در آمد. به یُمنِ قدمِ درویشان و صدقِ نَفَسِ ایشان ذَمائمِ اخلاقش به حَمائد مبدّل گشت. دست از هوا و هوس کوتاه کرده و زبانِ طاعنان در حقِ او همچنان دراز، که بر قاعدهٔ اوّل است و زهد و طاعتش نامُعَوَّل. به عذر و توبه توان رستن از عذابِ خدای
ولیک می‌نتوان از زبانِ مردم رَست طاقت جورِ زبان‌ها نیاورد و شکایت پیشِ پیرِ طریقت برد. جوابش داد که: شکرِ این نعمت چگونه گزاری که بهتر از آنی که پندارندت؟! چند گویی که بد اندیش و حسود
عیب‌جویانِ منِ مسکینند؟ گه به خون ریختنم برخیزند
گه به بد خواستنم بنشینند نیک باشی و بدت گوید خلق
به که بد باشی و نیکت بینند لیکن مرا -که حُسنِ ظَنِّ همگنان در حقّ من به کمال است و من در عینِ نقصان- روا باشد اندیشه بردن و تیمار خوردن. اِنّی لَمُسْتَتِرٌ مِنْ عَیْنِ جیرانی
وَ اللهُ یَعْلَمُ إِسْرارِی وَ إِعْلانی در بسته به روی خود ز مردم
تا عیب نگسترند ما را در بسته چه سود و عالِم‌الغیب
دانایِ نهان و آشکارا",2
"پیشِ یکی از مشایخ گله کردم که: فلان به فَسادِ من گواهی داده است. گفتا: به صَلاحش خجل کن! تو نیکو روِش باش تا بَدسگال
به نقصِ تو گفتن نیابد مَجال چو آهنگِ بربَط بود مستقیم
کی از دستِ مطرب خورد گوشمال؟",2
"یکی را از مشایخ شام پرسیدند از حقیقتِ تصوّف؛ گفت: پیش از این طایفه‌ای در جهان بودند به‌صورت پریشان و به‌معنی جمع، اکنون جماعتی هستند به‌صورت جمع و به‌معنی پریشان. چو هر ساعت از تو به جایی رود دل
به تنهایی اندر، صفایی نبینی ورت جاه و مال است و زَرع و تجارت
چو دل با خدای است، خلوت‌نشینی",2
"یاد دارم که شبی در کاروانی همه شب رفته بودم و سحر در کنارِ بیشه‌ای خفته. شوریده‌ای که در آن سفر همراهِ ما بود نعره‌ای برآورد و راهِ بیابان گرفت و یک نفس آرام نیافت. چون روز شد، گفتمش: آن چه حالت بود؟ گفت: بلبلان را دیدم که به نالش در آمده بودند از درخت، و کبکان از کوه و غوکان در آب و بَهایم از بیشه؛ اندیشه کردم که مروّت نباشد همه در تسبیح و من به غفلت خُفته. دوش مرغی به صبح می‌نالید
عقل و صبرم ببُرد و طاقت و هوش یکی از دوستان مخلِص را
مگر آواز من رسید به گوش گفت باور نداشتم که تو را
بانگِ مرغی چنین کند مدهوش گفتم: این شرطِ آدمیّت نیست
مرغْ تسبیح‌گوی و من خاموش",2
"وقتی در سفر حجاز طایفه‌ای جوانانِ صاحبدل هم‌دمِ من بودند و هم‌قدم؛ وقت‌ها زمزمه‌ای بکردندی و بیتی محقّقانه بگفتندی و عابدی در سَبیل، منکِر حالِ درویشان بود و بی‌خبر از دردِ ایشان. تا برسیدیم به خیلِ بنی‌هلال؛، کودکی سیاه از حَّیِ عرب به در آمد و آوازی بر آورد که مرغ از هوا در آورد. اشتر عابد را دیدم که به رقص اندر آمد و عابد را بینداخت و برفت. گفتم: ای شیخ! در حیوانی اثر کرد و تو را همچنان تفاوت نمی‌کند. دانی چه گفت مرا آن بلبل سحری؟
تو خود چه آدمیی کز عشق بی خبری! اشتر به شعرِ عرب در حالت است و طرب
گر ذوق نیست تو را، کژ طبع جانوری وَ عِنْدَ هُبُوبِ النّاشِراتِ عَلَی الْحِمیٰ
تَمیلُ غُصُونُ الْبانِ لا الْحَجَرُ الصَّلْدُ به ذکرش هر چه بینی در خروش است
دلی داند در این معنی که گوش است نه بلبل بر گلش تسبیح‌خوانی است
که هر خاری به تسبیحش زبانیست",2
"یکی را از ملوک مدّتِ عمر سپری شد، قائم‌مقامی نداشت، وصیّت کرد که بامدادان نخستین کسی که از در شهر اندر آید تاج شاهی بر سر وی نهند و تفویضِ مملکت بدو کنند. اتفاقاً اوّل کسی که در آمد گدایی بود همه عمر لقمه اندوخته و رُقْعه دوخته. ارکانِ دولت و اَعیانِ حضرت وصیّتِ ملِک به جای آوردند و تسلیمِ مَفاتیحِ قِلاع و خزاین بدو کردند و مدّتی مُلک راند تا بعضی امرایِ دولتْ گردن از طاعتِ او بپیچانیدند و ملوک از هر طرف به مُنازعت خاستن گرفتند و به مقاومت لشکر آراستن. فی‌الجمله، سپاه و رعیّت به هم بر آمدند و برخی طرفِ بلاد از قَبْضِ تصرُّفِ او به در رفت. درویش از این واقعه خسته‌خاطر همی‌بود تا یکی از دوستان قدیمش که در حالتِ درویشی قَرین بود از سفری باز آمد و در چنان مرتبه دیدش. گفت: منّت خدای را، عَزَّ وَ جَلَّ، که گُلت از خار بر آمد و خار از پای به در آمد و بختِ بلندت رهبری کرد و اقبال و سعادت یاوری، تا بدین پایه رسیدی؛ اِنَّ مَعَ الْعُسْرِ یُسْراً. شکوفه، گاه شکفته است و گاه خوشیده
درخت، وقت برهنه است و وقت پوشیده گفت: ای یارِ عزیز! تَعزیتم کن که جای تهنیت نیست. آنگه که تو دیدی، غمِ نانی داشتم و امروز تشویشِ جهانی. اگر دنیا نباشد، دردمندیم
وگر باشد، به مهرش پای‌بندیم حجابی زین درون‌آشوب‌تر نیست
که رنجِ خاطر است، اَر هست و گر نیست مَطَلب، گر توانگری خواهی
جز قناعت که دولتیست هَنی گر غنی زر به دامن افشاند
تا نظر در ثوابِ او نکنی کز بزرگان شنیده‌ام بسیار:
صبرِ درویش به که بَذلِ غنی اگر بریان کند بهرام، گوری
نه چون پایِ ملخ باشد ز موری",2
"ابوهُرَیْرَه، رَضِیَ اللهُ عَنْهُ، هر روز به خدمتِ مصطفی، صَلَّی اللهُ عَلَیْهِ، آمدی. گفت: یا اَباهُرَیْرَةٍ! زُرْنی غِبّاً، تَزْدَدْ حُبّاً: هر روز میا تا محبّت زیادت شود. صاحبدلی را گفتند: بدین خوبی که آفتاب است، نشنیده‌ایم که کس او را دوست گرفته است و عشق آورده. گفت: برای آنکه هر روز می‌توان دید مگر در زمستان که محجوب است و محبوب. به دیدارِ مردم شدن عیب نیست
ولیکن نه چندان که گویند: بس اگر خویشتن را ملامت کنی
ملامت نباید شنیدت ز کس",2
"یکی را از بزرگان بادی مخالف در شکم پیچیدن گرفت و طاقتِ ضبطِ آن نداشت و بی اختیار از او صادر شد. گفت ای دوستان! مرا در آنچه کردم اختیاری نبود و بَزَهی بر من ننوشتند و راحتی به وجودِ من رسید. شما هم به کَرَم معذور دارید. شکم زندانِ باد است ای خردمند
ندارد هیچ عاقل باد در بند چو باد اندر شکم پیچد فرو هل
که باد اندر شکم بار است بر دل حریفِ ترشرویِ ناسازگار
چو خواهد شدن دست پیشش مدار",2
"از صحبتِ یارانِ دِمَشْقم مَلالتی پدید آمده بود؛ سر در بیابانِ قُدس نهادم و با حیوانات اُنس گرفتم. تا وقتی که اسیرِ فرنگ شدم، در خَنْدَقِ طَرابُلُس با جُهودانم به کارِ گِل بداشتند. یکی از رؤسایِ حَلَب که سابقه‌ای میانِ ما بود گذر کرد و بشناخت و گفت: ای فلان! این چه حالت است؟! گفتم: چه گویم؟: همی گریختم از مردمان به کوه و به دشت
که از خدای نبودم به آدمی پرداخت قیاس کن که چه حالم بود در این ساعت
که در طویلهٔ نامردمم بباید ساخت پای در زنجیر پیشِ دوستان
بِهْ که با بیگانگان در بوستان بر حالتِ من رحمت آورد و به ده دینار از قیدم خلاص کرد و با خود به حلب برد و دختری که داشت به نِکاح من در آورد به کابین، صد دینار. مدّتی برآمد. بدخوی ستیزه‌روی نافرمان بود؛ زبان درازی کردن گرفت و عیشِ مرا مُنَغَّص داشتن. زنِ بد در سرایِ مردِ نکو
هم در این عالم است دوزخِ او زینهار از قرینِ بد، زِنهار!
وَ قِنا رَبَّنا عَذابَ النّار باری زبانِ تَعَنّت دراز کرده همی‌گفت: تو آن نیستی که پدرِ من تو را از فرنگ باز خرید؟! گفتم: بلی! من آنم که به ده دینار از قیدِ فرنگم بازخرید و به صد دینارْ به دستِ تو گرفتار کرد. شنیدم گوسپندی را بزرگی
رهانید از دهان و دستِ گرگی شبانگه کارد در حلقش بمالید
روانِ گوسپند از وی بنالید: که از چنگالِ گرگم در ربودی
چو دیدم عاقبت، خود گرگ بودی",2
